"房子名称","房子价格","房子单价","房子类型","房子地址","房子大小"
"南坪百盛对面，电梯一室一厅，精装修，带阳台，楼下就是商.圈","67","12884元/㎡","1室1厅1卫","南坪商业大厦-南坪二手房出售-南坪西路3号","52㎡"
"茶园新区，首付22万，90平3房2卫，碧桂园打造，双轻轨房","75","8333元/㎡","3室2厅2卫","麓铭府-界石二手房出售-东城大道","90㎡"
"星海湖好房 2室2厅  清水  价低  抢到就是赚","37","5211元/㎡","2室2厅1卫","海怡天星海湖-李渡二手房出售-聚龙大道78号","71㎡"
"石坪桥横街 永辉超市旁 桃源丽景 精装修 拎包入住 采光好","75","14150元/㎡","1室2厅1卫","桃源丽景-石坪桥二手房出售-盘龙正街","53㎡"
"大学城新盘 富力城院士庭精装修高层 近轻轨 目前意向登记中","78","10833元/㎡","2室2厅1卫","富力城地壹站-大学城二手房出售-大学城中路38号","72㎡"
"渝北新牌坊 大三房 看照母山 总价低 位置好 户型方正采光好","144.8","13790元/㎡","3室2厅2卫","海洲国际公寓-人和二手房出售-云杉北路81号","105㎡"
"渝中区大坪商圈 融创国宾壹号院 九龙之巅大平层 业主急售","345","19166元/㎡","4室2厅3卫","国宾壹号院-石桥铺二手房出售-虎歇路49号","180㎡"
"巴蜀学校本部指标房 只需30万 单间配套机会不多","30","15000元/㎡","1室1卫","钢铁设计院小...-一号桥二手房出售-双钢路,近琵琶山正街","20㎡"
"解放碑日月光旁  三跃顶层视野开阔  随时看房","250","14705元/㎡","5室2厅3卫","阳光星座-解放碑二手房出售-民生路9号","170㎡"
"新牌坊龙湖南苑 大四房 住家装修一梯两户 小区环境好配套丰富","185","11708元/㎡","4室2厅2卫","龙湖花园-龙溪二手房出售-新南路6号","158㎡"
"锦绣丽舍精装三房出售 全新装修 小区环境好 配套成熟随时看房","102","10285元/㎡","3室2厅2卫","锦绣丽舍-双凤桥二手房出售-港汇路88号","99㎡"
"抢！好地段，180万左右买精装四房，带地暖，树人小学读书指标","180","13432元/㎡","4室2厅2卫","万科金域华府-城南新区二手房出售-龙凤大道","134㎡"
"抢！两江新区新盘，看江大平层，三轨九个公园，带重点读书指标！","163","11478元/㎡","3室2厅2卫","渝能嘉湾壹号-蔡家岗二手房出售-同康路18号","142㎡"
"总价56万起买轻轨房，精装单身公寓，带租约，月租2560月起","60","14187元/㎡","1室1厅1卫","天景美梦城真-学府大道二手房出售-学府大道69号","42㎡"
"兴馨嘉园,龙头寺,庆北站,公交站,天宫殿菜市场,2室清水","119.8","14261元/㎡","2室2厅1卫","兴馨嘉园-龙头寺二手房出售-鲁渝大道999号","84㎡"
"南坪商圈 天盈首原 5.1米LOFT公寓 楼下就是轻轨3号线","75","15625元/㎡","2室2厅2卫","天盈首原-南滨路二手房出售-白鹤路45号","48㎡"
"兰湖天小区，高品质小区，出行方便","86","15127元/㎡","2室2厅1卫","兰湖天-四公里二手房出售-回龙路68号","56㎡"
"大学城，旭阳台北城，四室两厅跃层，采光好通风，周边配套齐全","146","11774元/㎡","4室2厅2卫","旭阳台北城敦...-大学城二手房出售-大学城南二路","124㎡"
"中渝精装大2房 带南开大一中指标，科院永辉超市近在咫尺。","88","10602元/㎡","2室2厅1卫","中渝春华秋实...-大学城二手房出售-大学城东路","83㎡"
"融创国宾壹号院，品质楼盘大隐于市，石桥铺核心位置","320","17391元/㎡","4室2厅2卫","国宾壹号院-石桥铺二手房出售-虎歇路49号","184㎡"
"新房，新房，新房装修未住人，攀华国际广场2室2厅 拎包入住","48","6956元/㎡","2室2厅1卫","攀华国际广场-李渡二手房出售-学府路","69㎡"
"南坪商圈，轻轨旁亚朵酒店带租约，月租2500起，精装","56","13241元/㎡","1室1厅1卫","天景美梦城真-学府大道二手房出售-学府大道69号","42㎡"
"大渡口钓鱼嘴中州半岛城帮 一手房源 洋房社区 滨江路江景","130","11403元/㎡","3室1厅2卫","中洲半岛城邦-茄子溪二手房出售-大滨中路1166号","114㎡"
"首付25万 购金科中央公园 2室2厅 拎包入住 业主急售","45","6818元/㎡","2室2厅1卫","涪陵金科中央...-李渡二手房出售-太乙大道28号","66㎡"
"融汇半岛玫瑰公馆精装3房拎包入住 业主诚心出售 随时看房","130","12621元/㎡","3室2厅2卫","融汇半岛玫瑰...-李家沱二手房出售-融汇大道11号","103㎡"
"人和轻轨站旁 精装大两房 全套家具家电 南极凤麟苑","123","11930元/㎡","2室2厅1卫","南极凤麟苑-人和二手房出售-胡杨路39号","103㎡"
"次新小区 仁安 装修三房 出门学效 坐拥双轻轨 买到就是","158","18372元/㎡","3室2厅1卫","仁安龙城国际-龙头寺二手房出售-新溉路881号","86㎡"
"大礼堂 小区电梯房 正规三房双卫 小区有坝子可供休闲娱乐乘凉","158","11048元/㎡","3室2厅2卫","龙泉花园-其他二手房出售-嘉滨路246号","143㎡"
"蓝光品质小区，新小区环境好，户型方正无浪费，赠送大，可看江","158","13277元/㎡","4室2厅2卫","蓝光林肯公园-李家沱二手房出售-渝南分流道,近二塘街","119㎡"
"渝北 新牌坊童心小学附近北回归线精装小两室 视野无敌随时看房","80","15754元/㎡","2室1厅1卫","北回归线-加洲新牌坊二手房出售-民安大道130号","50㎡"
"天一星城正规三房双卫，朝中挺，开阔的视野，新小区新装修","68.8","6490元/㎡","3室2厅2卫","天一星城-其他二手房出售-白龙大道369号","106㎡"
"渝北新牌坊，财富中心环线旁，证在手，急售2房，正常首付60万","120","14109元/㎡","2室2厅1卫","荣鼎国际-加洲新牌坊二手房出售-红锦大道611号","85㎡"
"双福 恒大一期带全新家具家电，拎包入住，楼层采光好，随时看房","103","9115元/㎡","3室2厅2卫","恒大金碧天下-恒大大道1号","113㎡"
"照母山北大资源博雅二期精装高层小三房 拎包入住","148","19728元/㎡","3室2厅1卫","北大资源博雅...-汽博中心二手房出售-湖霞街","75㎡"
"月光宝盒  正规大两房  精装修    总价低  仅此一套","83","13766元/㎡","2室1厅1卫","恒高月光宝盒-二郎二手房出售-朝阳路102号","60㎡"
"加新花园二区 精装修生活方便 门口就是公交交通便利 拎包入住","128","13763元/㎡","2室2厅1卫","加新花园二区-人和二手房出售-人和大道108号","93㎡"
"渝北悦来 棕榈泉 江景大平层 板式南北通透 2梯2户","360","17061元/㎡","4室2厅2卫","棕榈泉悦江国...-悦来二手房出售-国博大道,近悦来滨江路","211㎡"
"新牌坊核心，轻轨环线旁，荣鼎国际精装修大2房，首付60万","121","14226元/㎡","2室2厅1卫","荣鼎国际-加洲新牌坊二手房出售-红锦大道611号","85㎡"
"龙城国际二期 正三房采光好 双轻轨四通八达 随时看房 3房","155","18452元/㎡","3室1厅2卫","仁安龙城国际-龙头寺二手房出售-新溉路881号","84㎡"
"江北嘴 恒大中央广场 精装两房 未住过人 业主急售","165","19619元/㎡","2室2厅1卫","恒大中央广场-江北城二手房出售-天澜大道49号","84㎡"
"渝北照母山 金州商圈洋房恒大御府带露台 赠送大 环境优美","210","16030元/㎡","3室2厅1卫","恒大世纪城-汽博中心二手房出售-湖红路56号","131㎡"
"两路口七星岗轻轨旁临华路小区","23","7666元/㎡","1室1厅1卫","临华路小区-两路口二手房出售-临华路2号","30㎡"
"大阳台  海怡天星海湖82平方 2室2厅   业主急售","52","6341元/㎡","2室2厅1卫","海怡天星海湖-李渡二手房出售-聚龙大道78号","82㎡"
"南坪万达商圈 青青佳苑 出门就是星光时代广场 入读珊瑚小","80","15094元/㎡","1室1厅1卫","青青佳苑北苑-南滨路二手房出售-南湖路15号","53㎡"
"85万买6号线大竹林轻轨旁金科天元道高层 两室一厅 高性价比","85","13076元/㎡","2室2厅1卫","金科天元道-大竹林二手房出售-斑竹路8号","65㎡"
"大公馆转盘 华宇五环大厦 住家装修 大三房 诚心卖","140","9370元/㎡","3室2厅2卫","华宇五环大厦-谢家湾二手房出售-龙腾大道,近奥体路","149㎡"
"汽博中心金山名都精装大2房 拎包入住 交通便利 配套齐全","140","16949元/㎡","2室2厅1卫","龙脊金山名都-汽博中心二手房出售-金渝大道83号","82㎡"
"悦来北大资源一期联排别墅户型好使用面积达380平米，","280","14583元/㎡","5室3厅6卫","北大资源悦来-悦来二手房出售-悦城路33号","192㎡"
"急售了，急售了低于市场价的好房，业主急需用钱洋房品质高层价格","130.8","15086元/㎡","3室2厅2卫","千威先生的洋...-龙兴二手房出售-观月大道77号","86㎡"
"渝北民安大道轨道出口 锦上华庭观苑 正规三房 朝南 急售","165","16666元/㎡","3室2厅2卫","锦上华庭观苑-龙头寺二手房出售-泰山大道西段6号","99㎡"
"人和 北回归线轻轨房 精装一室带书房 视野采光好 配套成熟","81.8","16039元/㎡","2室1厅1卫","北回归线-加洲新牌坊二手房出售-民安大道130号","51㎡"
"南滨路江景别墅，单层面积100平，送电梯送产权车位，奢华享受","600","17142元/㎡","5室3厅4卫","峰墅-南滨路二手房出售-腾滨路,近南滨路","350㎡"
"雍江艺庭奢华的一线江景大户型精装全齐","500","24509元/㎡","4室2厅4卫","雍江艺庭-化龙桥二手房出售-瑞天路182号","204㎡"
"雍江翠湖 精装全齐看江两房视野无限","190","20000元/㎡","2室2厅1卫","雍江悦庭-化龙桥二手房出售-瑞天路附近","95㎡"
"四公里南坪中学对面 华城国际 精装小3房全新装修 急售","100","12820元/㎡","3室2厅1卫","弘扬华城国际-南坪二手房出售-白鹤路155号","78㎡"
"富力城清水大三房可以做四房业主诚心诚意急售！只要125万","125","10209元/㎡","3室2厅2卫","富力城时光里-大学城二手房出售-大学城南路12号","122㎡"
"江北嘴紫御江山一线江景小高层精装出售轻轨旁适合住家","360","24827元/㎡","4室2厅2卫","紫御江山紫峰-北滨路二手房出售-北滨二路537号","145㎡"
"西区公园式住宅小区 香城雅郡精装两房 中间楼层 采光好","138","16281元/㎡","2室2厅1卫","聚义香城雅郡-空港新城二手房出售-同盛路119号","84㎡"
"保利爱尚里，华媒时代城旁精装两房，价格便宜，看房方便","68","12830元/㎡","2室2厅1卫","阳光心悦-石坪桥二手房出售-石坪桥横街","53㎡"
"渝北照母山 协信星都会 精装大三房 拎包入住带车位","175","14700元/㎡","3室2厅2卫","协信星都会-人和二手房出售-金山大道203号","119㎡"
"照母山 恒大世纪城 洋房清水 诚心出售","180","15254元/㎡","3室2厅2卫","恒大世纪城-汽博中心二手房出售-湖红路56号","118㎡"
"恒大世纪城 洋房顶跃 带露台 内圈位置安静","340","19318元/㎡","4室3厅3卫","恒大世纪城-汽博中心二手房出售-湖红路56号","176㎡"
"金州小学旁 高品质小区 内圈洋房出售","300","20871元/㎡","3室2厅2卫","约克郡上林洋...-汽博中心二手房出售-金州大道160号","143㎡"
"墅藏照母山 何须羡独栋 以典藏八席臻墅 敬献品识之士","650","21666元/㎡","6室3厅6卫","世茂茂悦府(...-汽博中心二手房出售-湖红路365号","300㎡"
"碧津公园旁 双轻轨 金港国际精装四房，出门商业圈，满5年","145","10455元/㎡","4室2厅4卫","金港国际-空港新城二手房出售-金航路1号","138㎡"
"西区商业圈旁，花园洋房香城雅郡正3房，南北通透，全明户型","218.8","16123元/㎡","3室2厅2卫","聚义香城雅郡-空港新城二手房出售-同盛路119号","135㎡"
"西永一手好房直接办卡认购，横厅设计7米长超大阳台，数量有限！","130","13131元/㎡","3室2厅2卫","金科天宸-西永二手房出售-西盛路31号","99㎡"
"56万拎包入住华庭精装2室，还送露台","56","6511元/㎡","2室2厅1卫","桂溪华庭-月阳路40号","86㎡"
"攀华未来城   精装房  3室2厅家具家电齐 拎包入住","46.8","6077元/㎡","2室2厅1卫","攀华未来城-李渡二手房出售-聚龙大道76号","77㎡"
"鸳鸯 轻轨站旁 复地天玺 精装四房 全朝中庭 紧邻公园学校","260","17931元/㎡","4室2厅2卫","复地天玺-鸳鸯二手房出售-金渝大道，近金开大道","145㎡"
"观音桥商圈。正规2房。跃层体现精致生活","115","14024元/㎡","2室1厅1卫","梦幻21公寓-观音桥二手房出售-建新东一村61号","82㎡"
"加新花园二区 精装修生活方便 门口就是公交交通便利 拎包入住","128","13763元/㎡","2室2厅1卫","加新花园二区-人和二手房出售-人和大道108号","93㎡"
"金阳农场  无需排队 房源有限 先到先得 买到就赚到 读树人","98.2","9009元/㎡","3室2厅2卫","金阳第一农场...-大学城二手房出售-大学城南二路1001号","109㎡"
"急售！看江三房 只卖106万 业主诚心卖 巴滨路融汇半岛二期","106","12325元/㎡","3室2厅1卫","融汇半岛二期-李家沱二手房出售-融汇大道2号","86㎡"
"华岩新城.未来的九龙坡的中心.出门就是轻轨.正规三房拎包入住","89","9077元/㎡","3室2厅1卫","恒景天苑-中梁山二手房出售-华福大道,近金中大道","98㎡"
"江北***便宜的现房公寓 5.1米层高 买一享二 三轻轨","47","12051元/㎡","2室1厅1卫","绿地保税中心-寸滩二手房出售-金渝大道138号","39㎡"
"渝中区解放碑白象街 清水一线看江大平层4房 读人和街小学","430","21827元/㎡","4室2厅3卫","融创白象街-解放碑二手房出售-凯旋路16号","197㎡"
"重庆西，大学城旁，精装洋房，带家具家电，康养之城，私人医生","137","11229元/㎡","3室2厅2卫","中铁任之健康...-三担路","122㎡"
"大学城 金科廊桥水乡D区 四房两卫清水 带车位 诚心卖","140","11979元/㎡","4室2厅2卫","金科廊桥水乡...-大学城二手房出售-大学城南二路1000号","116㎡"
"四公里回龙湾小区，豪装顶跃，带50平屋顶花园，5房3卫！","262","12129元/㎡","5室2厅3卫","回龙湾小区-学府大道二手房出售-回龙路66号","216㎡"
"南坪二塘轻轨站 美梦成真 豪华装修56万起 月租金2560元","56","16000元/㎡","1室1厅1卫","天景美梦城真-学府大道二手房出售-学府大道69号","35㎡"
"南坪百盛对面，电梯一室一厅，精装修，带阳台，楼下就是商.圈","67","12884元/㎡","1室1厅1卫","南坪商业大厦-南坪二手房出售-南坪西路3号","52㎡"
"建面8400一平的正规大三房电梯房 千 万不要错过了 只一套","110","8461元/㎡","3室2厅2卫","恒鑫名城一期-二郎二手房出售-石新路218号","130㎡"
"融创匠心打造,品质大平层豪宅,住家好选择,大盘","312","16956元/㎡","5室2厅2卫","国宾壹号院-石桥铺二手房出售-虎歇路49号","184㎡"
"渝北轻轨5号线 金科天湖美镇 精装三房 环境优美 拎包入住","189.8","17254元/㎡","3室2厅2卫","金科天湖美镇-人和二手房出售-金开大道1号","110㎡"
"照母山 全新豪华装修 满两年 临商场近学校 看房方便诚心出售","260","22648元/㎡","3室2厅2卫","世茂茂悦府-人和二手房出售-湖红路365号","114㎡"
"江北嘴五里店 中维都市美邻 精装1房  看房方便","60","17341元/㎡","1室1卫","中维都市美邻-五里店二手房出售-海尔路161号","34㎡"
"人和轨道站  首付仅49万精装两房即可拥有 业主急急急","130","17808元/㎡","2室2厅1卫","万科缇香郡-人和二手房出售-白桦路6号","73㎡"
"圣湖天域位置，朝湖，家具家电齐全，，交通方便","188","12287元/㎡","3室2厅2卫","圣湖天域-回兴二手房出售-宝桐路1号","153㎡"
"38万抢体育场精装3室黄金楼层拎包入住","39.8","4234元/㎡","3室2厅2卫","西城雅豪苑-桂西大道北段140号","94㎡"
"新牌坊 君悦世纪 精装2房 总价不到一 业主诚心出售","95","17431元/㎡","2室2厅1卫","君悦世纪-加洲新牌坊二手房出售-红锦大道518号","54㎡"
"弹子石 中海国际社区水电气三通公寓 豪华装修","76.6","15632元/㎡","2室1厅1卫","国际社区观邸...-弹子石二手房出售-腾龙大道21号","49㎡"
"回兴  金鹏两江业主 品质小区 户型方正 采光好","113","15259元/㎡","2室1厅1卫","金鹏两江时光-农业园区二手房出售-宝圣大道599号","74㎡"
"回兴 金鹏旁  在水一方 正两室 超大阳台 业主诚心出售","90","11206元/㎡","2室1厅1卫","在水一方-回兴二手房出售-宝圣大道99号","80㎡"
"水木青华 电梯房10楼带20平米入户花园 环境优美 随时看房","168","9333元/㎡","3室2厅2卫","水木青华-回兴二手房出售-湖滨西路19号","180㎡"
"南平商圈二塘轻轨旁总价56万月租金高达两千元，低总价，高收低","56","16969元/㎡","1室1厅1卫","天景美梦城真-学府大道二手房出售-学府大道69号","33㎡"
"南坪东路 正规2房 女子医院 神火烧烤附近 楼梯房全款","58","8285元/㎡","2室2厅1卫","南坪东路45...-南坪二手房出售-南坪东路45号","70㎡"
"南滨路喜来登旁精装江景公寓 带租约 即买即租","135","26470元/㎡","1室1厅1卫","皇冠国际-南滨路二手房出售-南滨路68号","51㎡"
"尚品国际，清水3房户型方正采光好","56","6746元/㎡","3室2厅1卫","尚品国际-东莘路99号","83㎡"
"渝北空港金易星辰精装修小三房出售","112.8","14010元/㎡","3室2厅1卫","金易星辰-空港新城二手房出售-汉渝路198号","80㎡"
"总价56万起买轻轨房，精装单身公寓，带租约，月租2560月起","60","14184元/㎡","1室1厅1卫","天景美梦城真-学府大道二手房出售-学府大道69号","42㎡"
"New 大坪龙湖时代天街旁 5.1米 双轻轨 出租自用","80.2","12935元/㎡","2室1厅1卫","升伟中环广场-大坪二手房出售-虎歇路77号","62㎡"
"星海湖好房 2室2厅  清水  价低  抢到就是赚","37","5211元/㎡","2室2厅1卫","海怡天星海湖-李渡二手房出售-聚龙大道78号","71㎡"
"石坪桥横街 永辉超市旁 桃源丽景 精装修 拎包入住 采光好","75","14150元/㎡","1室2厅1卫","桃源丽景-石坪桥二手房出售-盘龙正街","53㎡"
"大学城新盘 富力城院士庭精装修高层 近轻轨 目前意向登记中","78","10833元/㎡","2室2厅1卫","富力城地壹站-大学城二手房出售-大学城中路38号","72㎡"
"渝北新牌坊 大三房 看照母山 总价低 位置好 户型方正采光好","144.8","13790元/㎡","3室2厅2卫","海洲国际公寓-人和二手房出售-云杉北路81号","105㎡"
"渝中区大坪商圈 融创国宾壹号院 九龙之巅大平层 业主急售","345","19166元/㎡","4室2厅3卫","国宾壹号院-石桥铺二手房出售-虎歇路49号","180㎡"
"巴蜀学校本部指标房 只需30万 单间配套机会不多","30","15000元/㎡","1室1卫","钢铁设计院小...-一号桥二手房出售-双钢路,近琵琶山正街","20㎡"
"解放碑日月光旁  三跃顶层视野开阔  随时看房","250","14705元/㎡","5室2厅3卫","阳光星座-解放碑二手房出售-民生路9号","170㎡"
"新牌坊龙湖南苑 大四房 住家装修一梯两户 小区环境好配套丰富","185","11708元/㎡","4室2厅2卫","龙湖花园-龙溪二手房出售-新南路6号","158㎡"
"锦绣丽舍精装三房出售 全新装修 小区环境好 配套成熟随时看房","102","10285元/㎡","3室2厅2卫","锦绣丽舍-双凤桥二手房出售-港汇路88号","99㎡"
"渝北回兴空港新城山水蓝庭小高层户型方正采光好出售","158","12963元/㎡","4室2厅2卫","山水蓝庭-空港新城二手房出售-金玉路9号","121㎡"
"观音桥商圈 品质小区 邦兴渝珠花苑 正规两室住家装修 位置好","88","11671元/㎡","2室2厅2卫","邦兴渝珠花苑-观音桥二手房出售-洋河中路82号","75㎡"
"照母山商圈，总价90万起，月收租高达9000月，12年租约","90","16363元/㎡","1室1厅1卫","北大资源博雅...-汽博中心二手房出售-金州大道106号","55㎡"
"新鸥鹏教育城巴南，拉菲公馆，云教育产业园，77买三房两卫","85","8594元/㎡","3室2厅2卫","新鸥鹏教育城...-龙洲湾新区二手房出售-鸥鹏大道2号","98㎡"
"瑞丰花苑，精装两房，因业主要去外地工作，这才挥泪出售","83.8","12892元/㎡","2室1厅1卫","瑞丰花苑-两路二手房出售-空港大道251号","65㎡"
"荣安明月江南 一线江景房 单价8000起 可直接认购 79万","74","8505元/㎡","3室2厅1卫","荣安明月江南-鱼洞二手房出售-鱼洞江滨路39号","87㎡"
"顺祥壹街区 正规两房带家具家电 育才95 朝中庭  抓紧机会","72","12000元/㎡","2室2厅1卫","古渡春色-九宫庙二手房出售-金桥路3号","60㎡"
"总价62万起，央企中铁健康城，精装带家电，私人医生，应有尽有","62","8857元/㎡","2室2厅2卫","中铁任之健康...-三担路","70㎡"
"茶园新区，首付22万，90平3房2卫，碧桂园打造，双轻轨房","75","8333元/㎡","3室2厅2卫","麓铭府-界石二手房出售-东城大道","90㎡"
"江北嘴 恒大中央广场 精装两房 未住过人 业主急售","165","19619元/㎡","2室2厅1卫","恒大中央广场-江北城二手房出售-天澜大道49号","84㎡"
"抢！好地段，180万左右买精装四房，带地暖，树人小学读书指标","180","13432元/㎡","4室2厅2卫","万科金域华府-城南新区二手房出售-龙凤大道","134㎡"
"抢！两江新区新盘，看江大平层，三轨九个公园，带重点读书指标！","163","11478元/㎡","3室2厅2卫","渝能嘉湾壹号-蔡家岗二手房出售-同康路18号","142㎡"
"总价56万起买轻轨房，精装单身公寓，带租约，月租2560月起","60","14187元/㎡","1室1厅1卫","天景美梦城真-学府大道二手房出售-学府大道69号","42㎡"
"兴馨嘉园,龙头寺,庆北站,公交站,天宫殿菜市场,2室清水","119.8","14261元/㎡","2室2厅1卫","兴馨嘉园-龙头寺二手房出售-鲁渝大道999号","84㎡"
"南坪商圈 天盈首原 5.1米LOFT公寓 楼下就是轻轨3号线","75","15625元/㎡","2室2厅2卫","天盈首原-南滨路二手房出售-白鹤路45号","48㎡"
"兰湖天小区，高品质小区，出行方便","86","15127元/㎡","2室2厅1卫","兰湖天-四公里二手房出售-回龙路68号","56㎡"
"大学城，旭阳台北城，四室两厅跃层，采光好通风，周边配套齐全","146","11774元/㎡","4室2厅2卫","旭阳台北城敦...-大学城二手房出售-大学城南二路","124㎡"
"中渝精装大2房 带南开大一中指标，科院永辉超市近在咫尺。","88","10602元/㎡","2室2厅1卫","中渝春华秋实...-大学城二手房出售-大学城东路","83㎡"
"融创国宾壹号院，品质楼盘大隐于市，石桥铺核心位置","320","17391元/㎡","4室2厅2卫","国宾壹号院-石桥铺二手房出售-虎歇路49号","184㎡"
"新房，新房，新房装修未住人，攀华国际广场2室2厅 拎包入住","48","6956元/㎡","2室2厅1卫","攀华国际广场-李渡二手房出售-学府路","69㎡"
"南坪商圈，轻轨旁亚朵酒店带租约，月租2500起，精装","56","13241元/㎡","1室1厅1卫","天景美梦城真-学府大道二手房出售-学府大道69号","42㎡"
"大渡口钓鱼嘴中州半岛城帮 一手房源 洋房社区 滨江路江景","130","11403元/㎡","3室1厅2卫","中洲半岛城邦-茄子溪二手房出售-大滨中路1166号","114㎡"
"首付25万 购金科中央公园 2室2厅 拎包入住 业主急售","45","6818元/㎡","2室2厅1卫","涪陵金科中央...-李渡二手房出售-太乙大道28号","66㎡"
"融汇半岛玫瑰公馆精装3房拎包入住 业主诚心出售 随时看房","130","12621元/㎡","3室2厅2卫","融汇半岛玫瑰...-李家沱二手房出售-融汇大道11号","103㎡"
"人和轻轨站旁 精装大两房 全套家具家电 南极凤麟苑","123","11930元/㎡","2室2厅1卫","南极凤麟苑-人和二手房出售-胡杨路39号","103㎡"
"次新小区 仁安 装修三房 出门学效 坐拥双轻轨 买到就是","158","18372元/㎡","3室2厅1卫","仁安龙城国际-龙头寺二手房出售-新溉路881号","86㎡"
"大礼堂 小区电梯房 正规三房双卫 小区有坝子可供休闲娱乐乘凉","158","11048元/㎡","3室2厅2卫","龙泉花园-其他二手房出售-嘉滨路246号","143㎡"
"蓝光品质小区，新小区环境好，户型方正无浪费，赠送大，可看江","158","13277元/㎡","4室2厅2卫","蓝光林肯公园-李家沱二手房出售-渝南分流道,近二塘街","119㎡"
"渝北 新牌坊童心小学附近北回归线精装小两室 视野无敌随时看房","80","15754元/㎡","2室1厅1卫","北回归线-加洲新牌坊二手房出售-民安大道130号","50㎡"
"天一星城正规三房双卫，朝中挺，开阔的视野，新小区新装修","68.8","6490元/㎡","3室2厅2卫","天一星城-其他二手房出售-白龙大道369号","106㎡"
"两路口七星岗轻轨旁临华路小区","23","7666元/㎡","1室1厅1卫","临华路小区-两路口二手房出售-临华路2号","30㎡"
"大阳台  海怡天星海湖82平方 2室2厅   业主急售","52","6341元/㎡","2室2厅1卫","海怡天星海湖-李渡二手房出售-聚龙大道78号","82㎡"
