"房子名称","房子价格","房子单价","房子类型","房子地址","房子大小"
"轻轨房  南坪 会展中心旁 亚太商谷精装修2房 拎包入住 急","105","16431元/㎡","2室1厅1卫","亚太商谷-南坪二手房出售-亚太路1号","63㎡"
"江北嘴紫御江山一线看江洋房 建面221平 五房 正看两江交汇","450","20361元/㎡","5室3厅3卫","紫御江山御湾-江北城二手房出售-北滨二路,近对山立交","221㎡"
"南坪 铜元局 南开中学旁 花漫庭豪装4房 看湖 品质小区 急","280","20241元/㎡","4室2厅2卫","融侨城花漫庭-铜元局二手房出售-风临路5号","138㎡"
"南川神龙峡山涧居 70年产权 首付2万起 买景区避暑现房","20","4000元/㎡","2室1厅1卫","金阳第一农场...-三汇村","50㎡"
"南岸区蓝光COCO精装跃层小两房实得60平米 高楼层62万","62","16315元/㎡","2室2厅1卫","蓝光COCO...-弹子石二手房出售-腾龙大道38号","38㎡"
"看好房美丽泽京爱尚里  精装三房 户型方正 彩光好 性价比高","89","8725元/㎡","3室2厅2卫","美丽泽京爱尚...-金龙大道","102㎡"
"鱼洞商圈 临轻轨站  精装正两房 鲁能南渝星城 带教育指标","78","12703元/㎡","2室2厅1卫","鲁能南渝星城-鱼洞二手房出售-箭河路600号","61㎡"
"沙坪坝 小龙砍诺丁阳光 正规2室  精装 采光好 不吵","120","15189元/㎡","2室2厅1卫","诺丁阳光-小龙坎二手房出售-小龙坎正街369号","79㎡"
"鸳鸯62万的两房 楼下50米轻轨站 多路公交直达","62","8266元/㎡","2室2厅1卫","丹鹤社区-鸳鸯二手房出售-鸳鸯路,近鸳鸯北路","75㎡"
"中冶熙城商街 24万起 1室1厅1卫 精装修超好","24","8275元/㎡","1室1厅1卫","中冶熙城商街-跳磴二手房出售-石林大道","29㎡"
"37区花叠 户型方正带大露台可做四房四卫 ，视野开阔没有遮挡","220","18487元/㎡","4室2厅4卫","金科城(别墅...-蔡家岗二手房出售-嘉景大道6号","119㎡"
"鱼洞一线江景 高层双轻轨首付21万  刚需客  带指标","57","7916元/㎡","2室2厅1卫","荣安明月江南-鱼洞二手房出售-鱼洞江滨路39号","72㎡"
"降价急卖 华润豪装大三房 送20平米大阳台 急 急 急","240","17738元/㎡","3室2厅2卫","华润中央公园-大石坝二手房出售-红原路66号","135㎡"
"弹子石CBD商圈，精装轻轨现房，水电气三通，拎包入住，急售","63","13125元/㎡","1室1厅1卫","国际社区观邸...-弹子石二手房出售-腾龙大道21号","48㎡"
"中干道 住家好楼层 单价不到5000 3室2厅 3楼的房子","45","5421元/㎡","3室2厅1卫","巴县大道37...-鱼洞二手房出售-巴县大道37号","83㎡"
"鱼洞轻轨站旁 鲁能南渝星城 清水2房 读鱼洞四小 近永辉超市","64","10372元/㎡","2室1厅1卫","鲁能南渝星城-鱼洞二手房出售-箭河路600号","61㎡"
"江北中海天钻首开 豪宅大平层 瞰龙头寺公园 客厅挑高6.8米","400","16806元/㎡","4室2厅3卫","中瑞方园天和...-其他二手房出售-龙头寺路,近红黄路","238㎡"
"石桥铺商圈，精装修，带15年租约， 无忧托管，陈家坪汽车站旁","45.6","16888元/㎡","1室1厅1卫","中国铁建玖城...-二郎二手房出售-石杨路66号","27㎡"
"新鸥鹏壹号公馆  精装三房  户型方正 百强物业 性价比高","72.8","7744元/㎡","3室2厅1卫","鸥鹏壹号公馆-龙城大道398号","94㎡"
"豪园5星.级的品质小区业主豪华装修大3房给你豪华的住家","65","6632元/㎡","3室2厅2卫","碧桂园豪园-凤城二手房出售-碧园路669号","98㎡"
"中冶熙城商街 24万起 1室1厅1卫 精装修超好","24","8275元/㎡","1室1厅1卫","中冶熙城商街-跳磴二手房出售-石林大道","29㎡"
"大渡口中心位置 科而士 天辰华府精装修 两房带大阳台","110","13095元/㎡","2室2厅1卫","科而士天辰华...-九宫庙二手房出售-松青路1109号","84㎡"
"步行街核心地段，名校指标，精装1房，带家具家电，拎包入住，","52","12682元/㎡","1室1卫","新天泽国际广...-步行街二手房出售-松青路1099号","41㎡"
"新上 渝北民安大道 华夏佳和苑 精装住家两房 户型方正","100","16750元/㎡","2室2厅1卫","华夏佳和苑-龙头寺二手房出售-太湖西路5号","59㎡"
"江南新城保亿湖山鹿鸣，品质叠拼别墅，赠送花园面积大","180","12403元/㎡","3室2厅2卫","光华安纳溪湖...-茶园新区二手房出售-米兰大道19号","145㎡"
"千威先生洋房出售 全新装修 欧式风格 环境优美 看房方便","132","15209元/㎡","3室2厅1卫","千威先生的洋...-龙兴二手房出售-观月大道77号","86㎡"
"渝北鸳鸯康桥融府 精装修正规三房 户型方正视野好无遮挡","172","17916元/㎡","3室2厅2卫","康桥融府-汽博中心二手房出售-湖霞街1号","96㎡"
"渝北汽博中心轻轨房 拎包入住精装跃层三房 低于市场价 捡趴活","124","13319元/㎡","3室1厅2卫","龙脊金山名都-汽博中心二手房出售-金渝大道83号","93㎡"
"南岸区 工贸轻轨站 智汇江南 精装2房 视野好 拎包入住","107","12382元/㎡","2室2厅1卫","智汇江南-南坪二手房出售-海铜路,近南坪西路","86㎡"
"法蓝西联排别墅，洋房的价格，位置安静视野好双车位，带读书指标","220","17054元/㎡","5室3厅3卫","法蓝西莊邸(...-茶园新区二手房出售-米兰大道","129㎡"
"金科端户别墅，实得面积大，花园大，你还在观望什么","320","13502元/㎡","5室2厅5卫","金科廊桥水乡...-大学城二手房出售-大学城南二路166号","237㎡"
"朝天门 热门楼盘 金禾丽都 精装三房看江 交通便利次新小区","150","15957元/㎡","3室2厅1卫","金禾丽都-解放碑二手房出售-道门口18号","94㎡"
"高品质洋房渝能嘉湾一号读朝阳小学精装三房哦 你值得拥有","120","13793元/㎡","3室1厅1卫","渝能嘉湾壹号-蔡家岗二手房出售-同康路18号","87㎡"
"江山国际 精心装修 正规小三房 住家安静","175","18716元/㎡","3室2厅1卫","和泓江山国际-大坪二手房出售-长江二路33号","93㎡"
"融汇半岛三期  精装居家小三室  安心卖  朝中庭住家安静","98","12894元/㎡","3室2厅1卫","融汇香缇卡纳-李家沱二手房出售-融汇大道5号","76㎡"
"这个夏天去哪里买房中铁任之健康城，壁山大路镇，城际高铁门口","69","9452元/㎡","2室1厅1卫","中铁任之健康...-三担路","73㎡"
"大学城新盘 富力城院士庭精装修高层 近轻轨 火爆登记中","91","10570元/㎡","3室2厅2卫","富力城瀚湖-沙坪坝二手房出售-大学城中路46号","86㎡"
"黄泥磅 奔力绿色空间 轻轨站旁 精装两房 出行方便","120","16901元/㎡","2室1厅1卫","奔力绿色空间-龙溪二手房出售-龙越路19号","71㎡"
"杨公桥 烈士墓 林泉雅舍 两室两厅 带大阳台","120","12903元/㎡","2室2厅1卫","华宇林泉雅舍-杨公桥二手房出售-小杨公桥168号","93㎡"
"南滨路纯别墅小区 联排中户可看江 现房送品牌电梯 全套房设计","533","16813元/㎡","5室3厅3卫","峰墅-南滨路二手房出售-腾滨路,近南滨路","317㎡"
"步行街上轻轨房 正规一室 朝小指标","50","11904元/㎡","1室1厅1卫","海宇祥和公寓-城南新区二手房出售-云华路370号","42㎡"
"渝北鲁能星城十二街区 采光充足视野开阔 看中庭带指标 带车位","185","19161元/㎡","2室2厅2卫","鲁能星城十二...-龙头寺二手房出售-渝鲁大道680号","96㎡"
"复地新城就 住家精装3房2卫 家电家具齐全","170","17525元/㎡","2室2厅1卫","复地新城就-农业园区二手房出售-金渝大道81号","97㎡"
"杨家坪商圈旁 华润二十四城小区 精装1室 配套齐全 近轻轨","70","15909元/㎡","1室1厅1卫","华润二十四城...-谢家湾二手房出售-谢家湾正街47号","44㎡"
"城南世家 精装三房 业主急售","98","14927元/㎡","3室1厅1卫","城南世家-南坪二手房出售-辅仁路19号","65㎡"
"双碑宏城名都 清水2室2厅出售","75","10000元/㎡","2室2厅1卫","宏城名都B区-双碑二手房出售-嘉勤路","75㎡"
"南坪业主诚心出售骏逸天下正规两房户型方正出行便利拎包入住","118","13563元/㎡","2室1厅1卫","骏逸天下-南坪二手房出售-丹龙路26号","87㎡"
"蔡家中庚城急售毛坯房 中层 超中庭 交通便利 看房方便","92","11299元/㎡","2室2厅1卫","中庚城F组团-蔡家岗二手房出售-云屏路11号","81㎡"
"高端豪华大小区，近领山坎砍下，看清山绿水，是住家的好地方！","62.8","7388元/㎡","3室2厅1卫","垫江碧桂园-天堂路93号","85㎡"
"哇塞塞打起灯笼找到的好房子锦天水岸朝人民公园大气洋房安逸惨了","80","6153元/㎡","4室2厅2卫","锦天水岸-其他二手房出售-金龙大道21号","130㎡"
"重百旁体检中心家属院5楼，123平，3室2卫，拎包入住","40","3252元/㎡","3室2厅2卫","时代商都-文星路248号","123㎡"
"馥溪美品质别墅 带花园 品质小区 视野开阔 出门重庆一中","300","12000元/㎡","5室3厅3卫","金科廊桥水乡...-大学城二手房出售-大学城南二路166号","250㎡"
"只要58万！阳光100怡景阁两房弹子石超低 价没有之一手慢无","58","12608元/㎡","2室1厅1卫","阳光100国...-玄坛庙二手房出售-涂山路","46㎡"
"首创豪装单配  全新装修 从未住过人 诚心卖 随时看房","73","16222元/㎡","1室1卫","首创鸿恩国际...-大石坝二手房出售-红石路138号","45㎡"
"单价9千买轻轨站 跃层小户型 可做2房 住家皆宜 36万起","45","9183元/㎡","2室1厅1卫","和泓四季D区-九龙二手房出售-华福大道","49㎡"
"温泉城 街面房 标准两室带阳台 全部家电家具 业主急卖","53","8412元/㎡","2室2厅1卫","泽胜温泉城四...-其他二手房出售-兴涪路","63㎡"
"中铁任之健康城，精装高端养老度假区，有洋房，别墅，高层","150","10638元/㎡","3室2厅2卫","中铁任之健康...-三担路","141㎡"
"龙州湾 鸥鹏教育城 精装三房 110万带品牌家电 满2年","110","12643元/㎡","3室2厅1卫","新鸥鹏教育城...-一品二手房出售-鸥鹏大道","87㎡"
"豪园5星.级的品质小区业主豪华装修大3房给你豪华的住家","65","6632元/㎡","3室2厅2卫","碧桂园豪园-凤城二手房出售-碧园路669号","98㎡"
"佳兴诚推尚品国际正宗两房精装修户型方正拎包入住随时看房","53.8","8276元/㎡","2室2厅1卫","尚品国际-东莘路99号","65㎡"
"强力推荐 美丽泽京爱尚里  精装三室  配套成熟 不要错过","87.8","9051元/㎡","3室2厅2卫","美丽泽京爱尚...-金龙大道","97㎡"
"铜梁外国语小学旁 罗曼山电梯精装三室 采光好 户型正环境优雅","66","7333元/㎡","3室2厅1卫","罗曼山-平安路60号","90㎡"
"。沙滨路华宇金沙港湾 精装三房 楼层适中 采光好适合多口之家","185","13405元/㎡","3室2厅2卫","华宇金沙港湾...-土湾二手房出售-华宇金沙港湾8号","138㎡"
"。雾都大厦 精装大三房 带实验指标 商圈地段 出入方便。","165","11301元/㎡","3室2厅2卫","雾都大厦-沙滨路二手房出售-小龙坎正街139号","146㎡"
"坝子 坝子 超大坝子 只有你想不到 先到先得 机会难得唯一","55","8208元/㎡","2室2厅1卫","尚品国际-东莘路99号","67㎡"
"亲水湾精装三房    全景阳台中间楼层 赠家具电  拎包入住","72.6","7484元/㎡","3室2厅1卫","亲水湾-白龙大道149号","97㎡"
"金科精装直厅正规三房  户型方正 小区7号门出去重庆一中","95","11725元/㎡","3室2厅1卫","金科廊桥天都-大学城二手房出售-大学城南二路1080号","81㎡"
"确认过眼神遇见对的人爱尚里精装小三房质量放心你一定会爱上的","64","7619元/㎡","3室2厅1卫","美丽泽京爱尚...-金龙大道","84㎡"
"尚品世家 新出三房 拎包入住 全新装修 独特的地段成熟型小区","66.8","7031元/㎡","3室2厅1卫","尚品世家-学府大道88号","95㎡"
"看好房美丽泽京爱尚里   精装三室  户型宽敞  性价比高","73.8","7530元/㎡","3室2厅1卫","美丽泽京爱尚...-金龙大道","98㎡"
"哇塞塞打起灯笼找到的好房子锦天水岸朝人民公园大气洋房安逸惨了","80","6153元/㎡","4室2厅2卫","锦天水岸-其他二手房出售-金龙大道21号","130㎡"
"南坪 铜元局 云满庭B区精装2房 拎包入住 视野开阔 保持好","140","15270元/㎡","2室2厅1卫","云满庭B区-铜元局二手房出售-明佳路33号","91㎡"
"刚出精装两房带书房  两面采光 业主安心卖","72.5","18034元/㎡","2室2厅1卫","同景国际城W...-茶园新区二手房出售-丁香路1号","40㎡"
"南坪品质小区罗马假日清水两房户型方正可改三房交通便利拎包入住","114","12914元/㎡","2室2厅2卫","金阳罗马假日-经开区二手房出售-青龙路36号","88㎡"
"南滨路瞰江公寓，皇冠 国际，南滨花园核心地标，租金5000起","135","26470元/㎡","1室1厅1卫","皇冠国际-南滨路二手房出售-南滨路68号","51㎡"
"协信星都会 紧凑两房 清水房 朝南 诚心出售","105","15909元/㎡","2室1厅1卫","协信星都会-人和二手房出售-金山大道203号","66㎡"
"此房为业主精装房，户型方正大气，采光好通透，品牌家具家电","68","6355元/㎡","3室2厅2卫","纯阳江城福地-杨柳街1号","107㎡"
"杨家坪步行街旁，精装现房，带6年酒店租约，购物便捷，超划算！","42","12000元/㎡","1室1厅1卫","北大资源燕南-杨家坪二手房出售-兴堰路11号","35㎡"
"佳兴诚推品质小区龙轩大地豪华装修正三房一万多的床垫拎包入住","68","7311元/㎡","3室3厅1卫","龙轩大地-白龙大道333号","93㎡"
"富力城时光里 精装三房双卫 位置当道位置好 地铁就在家门口","126","13695元/㎡","3室1厅2卫","富力城时光里-大学城二手房出售-大学城南路12号","92㎡"
"。华宇广场 世纪银河 通气 带树人指标业主急售诚心出售。","64","21192元/㎡","1室1卫","世纪银河-沙坪坝二手房出售-沙坪坝站北路,近沙坪坝...","30㎡"
"杨家坪，北大资源燕南，蚂蚁公馆，精装公寓，带读书指标，带指标","45","13636元/㎡","1室1厅1卫","北大资源燕南-杨家坪二手房出售-兴堰路11号","33㎡"
"南坪商圈，精致两房5.1米挑高，买1层送1层，轻轨环线配套齐","60","15483元/㎡","2室2厅1卫","天盈首原-南滨路二手房出售-白鹤路45号","38㎡"
"龙洲湾精装高层和泓文华府双轻轨南北通透首付30万","103","10300元/㎡","3室2厅2卫","和泓文华府-一品二手房出售-渝南大道1388号","100㎡"
"靠山看水 右边是公园 左边是大酒店 出门就是体育馆 只有你想","67.6","7681元/㎡","3室2厅1卫","龙腾盛世-塔山街120号","88㎡"
"江北嘴CBD 新欧鹏对面 简装3房123万 看房方便","120","11538元/㎡","3室2厅2卫","蓝色经典小区-五里店二手房出售-海尔路9号","104㎡"
"石坪桥横街 永辉超市旁 桃源丽景 精装修 拎包入住 采光好","75","14150元/㎡","1室2厅1卫","桃源丽景-石坪桥二手房出售-盘龙正街","53㎡"
"毛坯价买观江房东海滨江城豪装观江大三房来袭你值得拥有","76.8","7680元/㎡","3室2厅2卫","东海滨江城观...-嘉陵路29号","100㎡"
"合川中悦城，精装三房","65","7182元/㎡","3室2厅2卫","中悦城尚城-名人街57号","90㎡"
"来看美丽泽京 精装三房  户型方正 采光好 住家选择","54.8","7828元/㎡","3室2厅1卫","美丽泽京-金龙大道","70㎡"
"观音桥商圈 观府国际 正规大2房 低于市场价25万急售","139.9","19988元/㎡","2室1厅1卫","光华观府国际-观音桥二手房出售-华新街96号","69㎡"
"急急急 金辉城住家精装2房129万 朝中庭  急急急 急急急","128","17066元/㎡","2室2厅1卫","金辉城春上南...-铜元局二手房出售-风临路3号","75㎡"
"红旗河沟，精装全智能小户型，月租3000起，出门轻轨，公交站","65","16250元/㎡","1室1厅1卫","东原世界时-观音桥二手房出售-红石路,近建北八支路","40㎡"
"西政片区品质小区两房出售","75","9624元/㎡","2室2厅1卫","在水一方-回兴二手房出售-宝圣大道99号","77㎡"
"江北南桥寺 名门山庄三期商品新房 尚林汇景豪装三房 品牌家电","140","13592元/㎡","3室2厅2卫","尚林汇景-石马河二手房出售-盘溪三支路83号","103㎡"
"北碚金域华府一手精装洋房高层帮你拿 带地暖朝中庭 阔景大阳台","110","11340元/㎡","3室2厅2卫","万科金域华府-城南新区二手房出售-龙凤大道","97㎡"
"联发欣悦 正规三房出门轻轨站，业主急售，仅此一套，看房方便","113","15270元/㎡","3室2厅2卫","联发欣悦-石坪桥二手房出售-云龙大道11号","74㎡"
"逸景苑，小洋房，拎包入住。","135","8035元/㎡","4室2厅2卫","海宇逸景苑-城南新区二手房出售-卢作孚路222号","168㎡"
"铜梁中心地段新老城交汇阳光丽都新城洋房豪华家装拎包入住","69.9","6354元/㎡","3室2厅2卫","阳光丽都新城-东莘路333号","110㎡"
"外国语学校旁 罗曼山 电梯精装三室 户型方正 视野广 诚心售","65.8","7393元/㎡","3室2厅1卫","罗曼山-平安路60号","89㎡"
"。沙坪坝区 工人村 奥林骄子 带30平米露台花园 可改3房。","96","11162元/㎡","2室2厅1卫","奥林娇子-三峡广场二手房出售-工人村64号","86㎡"
"温莎名苑洋房豪装正四房赠送多户型采光超好四面朝中庭环境安静","88","7333元/㎡","4室2厅2卫","柏涟温莎名苑-其他二手房出售-学府大道","120㎡"
"翰林港湾电梯房清水三室两卫看长江全景，是你梦寐以求的幸福家园","35","2916元/㎡","3室2厅2卫","长寿区翰林港...-凤城二手房出售-益民街11号","120㎡"
"新鸥鹏 第 一 书香精装三房  户型方正 家具齐全 品牌物业","65.8","7311元/㎡","3室2厅2卫","第一书香-塔山东街","90㎡"
"特大好消息凤凰郡清水电梯洋房大三室 南北通透地段好稀 缺房源","84.8","7204元/㎡","3室2厅2卫","双远凤凰郡-其他二手房出售-春东路199号","117㎡"
"江北嘴金叶世家 装修3房170万 住家安静 读新村小学","170","10967元/㎡","3室2厅2卫","金叶世家-五里店二手房出售-五江路19号","155㎡"
"轻轨6号出口 巴蜀城精装3房 带外阳台 拎包入住 看房方便","190","15359元/㎡","3室2厅2卫","庆业巴蜀城-五里店二手房出售-海尔路6号","123㎡"
"工贸站 重百旁 浪高精装正规跃层106万 诚意出售 带家电","106","18463元/㎡","2室2厅2卫","韵阁-南坪二手房出售-南坪新街","57㎡"
"小龙坎众科天一阁，精装跃层，性价比超高，离地铁近拎包入住","45","24232元/㎡","1室1厅1卫","众科天一阁-小龙坎二手房出售-小龙坎正街4号","18㎡"
"五里店精装大3房 轻轨10号线 住家大气 看房方便","155","10689元/㎡","3室2厅1卫","万丰花园-五里店二手房出售-建新东路251号","145㎡"
"福兴诚推北京城建电梯经典三室 装修个性十足 便利生活触手可及","76.5","8315元/㎡","3室2厅1卫","欧陆经典住宅...-金龙大道388号","92㎡"
"沙坪坝区 小龙坎众科天一阁 两室一厅 21平 交通方便","48","23540元/㎡","2室1厅1卫","众科天一阁-小龙坎二手房出售-小龙坎正街4号","20㎡"
"山宅七栋小高层精装修大3房拎包入住自带游泳池","198","15230元/㎡","3室2厅2卫","学府大道山宅-学府大道二手房出售-学府大道69号","130㎡"
"花滩丁香郡 一套 清水房，慢了就没有了","82","6406元/㎡","3室2厅2卫","花滩国际新城...-丁香路26号","128㎡"
"弹子石CBD商圈,精装现房,水电气三通,拎包入住,宜住宜租","66","13469元/㎡","1室1厅1卫","国际社区海悦...-弹子石二手房出售-福民路39号","49㎡"
"业主急售  蓝谷黑骏 简装修 带兰花指标 楼下公交站 带阳台","95","11585元/㎡","2室2厅1卫","蓝谷黑骏-其他二手房出售-石新路121号","82㎡"
"南坪 东原锦悦 东东摩旁 精装2房 出行方便 邻近轻轨","130","18767元/㎡","2室1厅1卫","东原锦悦-南坪二手房出售-南坪东路,近南坪东路二巷","69㎡"
"轻轨房 万达步行街旁 浪高精装正规跃层2房103万 随时看房","103","23073元/㎡","2室2厅2卫","浪高美阁-南坪二手房出售-江南大道7号","44㎡"
"欧朋壹号公馆豪华装修正宗四房设计，业主呕心沥血之为更完美","95","8189元/㎡","4室2厅2卫","鸥鹏壹号公馆-龙城大道398号","116㎡"
"北京城建 新出豪华装修 正三房 不一样的风格 只为你温馨的家","76.8","8439元/㎡","3室2厅1卫","欧陆经典住宅...-金龙大道388号","91㎡"
"看好房 尚品世家豪华装修  家具齐全 户型方正 性价比高","115","8712元/㎡","4室2厅2卫","尚品世家-学府大道88号","132㎡"
"中国十大豪宅之一 两江新区纯独栋别墅区 山顶看江别墅","2000","20833元/㎡","5室3厅5卫","财信赖特与山-其他二手房出售-逸兴路386号","960㎡"
"回兴 圣湖天域 旁乐信爱琴屿 小两室  50平方","75","15000元/㎡","2室1厅1卫","乐信爱琴屿-双凤桥二手房出售-康兴路2号","50㎡"
"四公里 巨成龙湾 住家两房 保持很好 交通方便 业主便宜出售","110","14285元/㎡","2室2厅1卫","巨成龙湾-经开区二手房出售-青龙路8号","77㎡"
"石桥铺5.1米跃层 3000旅居托管运营回 报率8.85个点","78.5","21216元/㎡","2室1厅2卫","鹏润悦秀城-石桥铺二手房出售-石杨路,近朝阳路","37㎡"
"上海城东门 天福克拉精装单配38万 户型方正  租金稳定","38","13571元/㎡","1室1卫","重庆天福克拉...-南坪二手房出售-南坪西路28号","28㎡"
"人和康居两房 户型方正 采光很好 出行方便","68","8143元/㎡","2室2厅1卫","人和康居二期-人和二手房出售-龙寿路1018号","83㎡"
"康田西锦正规大2房 户型方正 业主急售，出行方便 轻轨房","95","12052元/㎡","2室1厅1卫","康田西锦-二郎二手房出售-科技大道120号","78㎡"
"只要145万，可变五房轻轨站北滨路上，低于市场价50万","200","16000元/㎡","4室2厅2卫","东原D7区3...-大石坝二手房出售-红兴路80号","125㎡"
"渝北 新牌坊 中渝都会首站 大两房 办公装修  多栋写字楼","132","16296元/㎡","2室1厅1卫","中渝都会首站-双凤桥二手房出售-金山路18号","81㎡"
"茶园南 品质新盘 3房2卫 平层3梯6户 尽量全款 看房预约","88","9887元/㎡","3室2厅1卫","麓铭府-界石二手房出售-东城大道","89㎡"
"江北嘴 首开中海天钻 豪宅大平层 俯瞰龙头寺公园 挑高6米8","370","15546元/㎡","4室2厅3卫","中瑞方园天和...-其他二手房出售-龙头寺路,近红黄路","238㎡"
"步行街旁香港城  两房可改三房  业主诚心出售，看房方便","98","11529元/㎡","1室","佳禾钰茂香港...-九宫庙二手房出售-松青路1048号","85㎡"
"首付24万 圣豪帝景 大一室 可改二室 大阳台 52万出售","52","9811元/㎡","2室1厅1卫","圣豪帝景-两路二手房出售-五星路六巷49号","53㎡"
"华润公园 绝世顶跃 清水房稀.缺户型 俯瞰渝中 先到先得","288","22325元/㎡","5室2厅3卫","华润中央公园-大石坝二手房出售-红原路66号","129㎡"
"新牌坊核心 渝复丽园 住家精装配套成熟 户型采光无敌地段为王","155","12831元/㎡","3室2厅2卫","渝复丽园-新牌坊1路251号","120㎡"
"石桥铺商圈陈家坪汽车站旁 希岸酒店托管运营 租金高 回资金快","45.6","16888元/㎡","1室1厅1卫","中国铁建玖城...-二郎二手房出售-石杨路66号","27㎡"
"大学城 精致温馨小两房 无浪费空间 间间有采光 小两口的一选","73","14038元/㎡","2室2厅1卫","葛洲坝微客公...-陈家桥二手房出售-大学城东路72号","52㎡"
"看好房  尚品国际精装三室   户型方正  家具齐全 很不错","61.8","7725元/㎡","3室2厅1卫","尚品国际-东莘路99号","80㎡"
"新巴中旁第 一书香豪华装修家电齐全拎包入住读二小周边配套齐全","68","7010元/㎡","3室2厅2卫","第一书香-塔山东街","97㎡"
"南坪商圈 万达步行街旁 浪高精装跃层2房113万 可改3房","113","19737元/㎡","2室2厅2卫","韵阁-南坪二手房出售-南坪新街","57㎡"
"大学城 近商圈轻轨 沙小指标 配套齐全 精装3房 业主急售","99","11199元/㎡","3室2厅1卫","协信城立方一...-大学城二手房出售-大学城中路6号","88㎡"
"保利香槟花园D区  精装三房  住家装修 中间楼层 看中庭","142","16763元/㎡","2室2厅1卫","保利香槟花园...-龙头寺二手房出售-玉兰路203号","84㎡"
"龙轩大地 中间楼层 家装家装 实木家具品牌电器 业主急售","66.8","7031元/㎡","3室2厅1卫","龙轩大地-白龙大道333号","95㎡"
"城市星都 电梯清水两室老城中心送100平露台烧烤聚会嗨趴","34.8","6000元/㎡","2室1厅1卫","城市星都-营盘路99号","58㎡"
"正三室 采光户型好 房子大气清爽 我说得好 没你看一眼感情好","51","6746元/㎡","3室1厅1卫","置地银座-文化路","75㎡"
"带150平米屋顶大露台，小区房精装修3室2厅2卫，拎包入住。","38","2814元/㎡","3室2厅2卫","凤都苑-凤城二手房出售-黄东路三号","135㎡"
"石坪桥横街 永辉超市 阳光心悦 拎包入住 采光好 配套成熟","68","12830元/㎡","2室2厅1卫","阳光心悦-石坪桥二手房出售-石坪桥横街","53㎡"
