"房子名称","房子价格","房子单价","房子类型","房子地址","房子大小"
"北门清水房 随意装修 视野超好","62","5299元/㎡","3室2厅2卫","帝豪名门-重工农北路511号","117㎡"
"通气 通气 通气两江新区蔡家轻轨 5.1米层高公寓","35","9722元/㎡","2室2厅2卫","隆鑫爱琴海(...-蔡家岗二手房出售-同华路78号","36㎡"
"丰业御景铭洲，中等装修两房 朝向好 住家安静 配套实施齐全","148","18417元/㎡","2室2厅1卫","丰业御景铭洲-龙头寺二手房出售-尚品路1000号","80㎡"
"茶园邱家湾轻轨站旁 同景国际城 精装3房2卫 周边配套成熟","85","17006元/㎡","3室2厅2卫","同景国际城W...-茶园新区二手房出售-丁香路1号","49㎡"
"香缇时光 精装3房 给你阳光温馨舒适的家","75.8","7288元/㎡","3室2厅2卫","昕晖香缇时光-和顺大道","104㎡"
"龙山观邸婚房三室拎包入住，密码锁高档大气","72","7500元/㎡","3室2厅2卫","龙山观邸-牌楼二手房出售-沙龙路二段1318号","96㎡"
"弹子石CBD国际社区月亮级精装房，三通，拎包入住","60","15000元/㎡","2室1厅1卫","国际社区江御-南滨路二手房出售-腾龙大道23号","40㎡"
"宝龙城市广场精装修，舒适宽裕房型","55.8","6804元/㎡","2室2厅1卫","宝龙城市广场-合阳大道618号","82㎡"
"150平米露台，精装修3室2厅2卫，便宜卖了。","57","5428元/㎡","3室2厅2卫","凤西苑北区-凤城二手房出售-建新路","105㎡"
"紫御江山御湾，高层全江景，无遮挡，客厅，卧室正看江，户型正","340","26153元/㎡","3室2厅2卫","紫御江山御湾-江北城二手房出售-北滨二路,近对山立交","130㎡"
"江北精装小户,，轻轨沿线，带租约销售，租金抵月供，紧邻观音桥","40","14814元/㎡","1室1厅1卫","碧桂园嘉誉-新溉路二手房出售-丽园路","27㎡"
"石桥铺万昌精装loft公寓，带十年真实有效租约，月租6000","80","23529元/㎡","2室1厅1卫","鹏润悦秀城-石桥铺二手房出售-石杨路,近朝阳路","34㎡"
"龙头寺公园,双轻轨！居家舒适,精装修两房！","128","18823元/㎡","2室1厅1卫","仁安龙城国际-龙头寺二手房出售-新溉路881号","68㎡"
"骆驼首推 富力城倾城里精装一房急售，真实图片，随时看房","65","11745元/㎡","1室1厅1卫","富力城倾城里-大学城二手房出售-大学城中路34号","55㎡"
"九街区房，业主急到卖！","120","14354元/㎡","2室2厅1卫","金科天宸-西永二手房出售-西盛路31号","83㎡"
"万达广场旁精装2房书房","75","19016元/㎡","2室2厅1卫","同景国际城W...-茶园新区二手房出售-丁香路1号","39㎡"
"津都海岸超值两房，看中庭视野不错。小区环境很好","64","7529元/㎡","2室2厅1卫","恒通津都海岸-滨江大道鼎山段467号","85㎡"
"渝北  鸳鸯大雅云居山 精装两房 只要125万 低于市场价","125","16191元/㎡","2室2厅1卫","大雅云居山-鸳鸯二手房出售-龙展路59号","77㎡"
"3号线 汽博旁 复地别院 清水 洋房顶跃 可改5室","250","12953元/㎡","4室2厅2卫","复地别院-鸳鸯二手房出售-金渝大道81号","193㎡"
"银翔翡翠谷 清水大两房 近轻轨 诚心出售 出行便利 采光好","92","14603元/㎡","2室2厅1卫","银翔翡翠谷B...-茶园新区二手房出售-兴塘路8号","63㎡"
"奥园越时代建面88三房双卫满，业主稳定近轻轨105万急售","105","11666元/㎡","3室2厅2卫","奥园越时代D...-茶园新区二手房出售-创智路92号","90㎡"
"福兴诚推北京城建 电梯精家装大三房 无甲醛住家放心 拎包入住","74.8","8043元/㎡","3室2厅1卫","欧陆经典住宅...-金龙大道388号","93㎡"
"福兴诚推罗曼山 电梯三室 学 区房一站式读书 接送孩 子方便","65.5","7359元/㎡","3室2厅1卫","罗曼山-平安路60号","89㎡"
"金龙大道 北京城建 经 典家装三室 户型方正 采光好 环境优","76","8172元/㎡","3室3厅1卫","欧陆经典住宅...-金龙大道388号","93㎡"
"弹子石CBD国际社区月亮级精装房，三通，拎包入住","60","15000元/㎡","2室1厅1卫","国际社区江御-南滨路二手房出售-腾龙大道23号","40㎡"
"宝龙城市广场精装修，舒适宽裕房型","55.8","6804元/㎡","2室2厅1卫","宝龙城市广场-合阳大道618号","82㎡"
"150平米露台，精装修3室2厅2卫，便宜卖了。","57","5428元/㎡","3室2厅2卫","凤西苑北区-凤城二手房出售-建新路","105㎡"
"紫御江山御湾，高层全江景，无遮挡，客厅，卧室正看江，户型正","340","26153元/㎡","3室2厅2卫","紫御江山御湾-江北城二手房出售-北滨二路,近对山立交","130㎡"
"经典大跃 赠送面多  豪华装修32万 带家具家电 业主急售","125","12135元/㎡","3室2厅2卫","长帆汀蓝郡-中梁山二手房出售-华龙大道217号","103㎡"
"融侨香弥山 看江精装2房 上午看房手慢无 融侨彩虹道旁 急售","115","15540元/㎡","2室2厅2卫","融侨半岛香弥...-铜元局二手房出售-双峰山路,近海桐路","74㎡"
"渝北空港茂宸广场，跃层小户型，50亩公园环绕，商圈就在楼下","60","12000元/㎡","2室1厅2卫","桥达蓝湾半岛-龙兴二手房出售-观月北路217号","50㎡"
"渝北明安大道轻轨旁 童心小学旁 装修小两房 亏本急售","85","14718元/㎡","2室1厅1卫","亚热带雅居-人和二手房出售-云岗路","57㎡"
"渝北九建公交旁 广电华府 精装修两房 家电齐全 拎包入住","86.8","19958元/㎡","2室2厅1卫","广电华府-双凤桥二手房出售-天龙支路28号","43㎡"
"重庆西站旁  精装1房 门口商圈轻轨 国庆特惠10万","42","13125元/㎡","1室1厅1卫","中航九悦荟-二郎二手房出售-火炬大道5号","32㎡"
"御景江城婚房三室两厅两卫，送大阳台，拎包入住","85","7522元/㎡","3室2厅2卫","兴茂御景江城-柱山二手房出售-石峰路","113㎡"
"磁器口万科金域华庭 精装四房带地暖 树人小学重庆七中","175","13257元/㎡","4室2厅2卫","金融街金悦府-磁器口二手房出售-大水井7678号","132㎡"
"南开学校旁 融侨城湖汀四栋 简装三房双卫带入户花园长阳台","255","21555元/㎡","3室2厅2卫","融侨城二期A...-铜元局二手房出售-风临路17号","118㎡"
"南开学校对面 融侨城湖汀四栋 精装三房双卫 采光好 诚心卖","215","18189元/㎡","3室2厅2卫","融侨城二期A...-铜元局二手房出售-风临路17号","118㎡"
"南滨路双子塔旁江景房三梯三户10米阔景阳台揽长江观渝中","375","20885元/㎡","5室2厅3卫","皇冠国际-南滨路二手房出售-南滨路68号","179㎡"
"月租3000起丶西客站旁丶二郎轻轨环线丶精装修跃层丶即买即赚","40","12500元/㎡","1室1厅1卫","中航九悦荟-二郎二手房出售-火炬大道5号","32㎡"
"同景国际精装N组团三房   临近商圈近轻轨  带读名校指标","126","15180元/㎡","3室2厅2卫","同景国际城香...-茶园新区二手房出售-香溪路2号","83㎡"
"弹子石 中核 紫金一品 清水三房 业主急售 2017年次新","135","18493元/㎡","3室2厅1卫","中国核建紫金...-弹子石二手房出售-学苑路3号","73㎡"
"奥园三房 近轻轨和广场 商圈中心 茶园中心地带","150","16666元/㎡","3室2厅2卫","奥园城市天地...-南岸周边二手房出售-天文天道37号","90㎡"
"观音桥轻轨站出口 临街门面出售 仅售80万起带租约即买即收租","114","14490元/㎡","1室1厅1卫","聚丰纵横国际-五里店二手房出售-观音桥步行街16号","78㎡"
"海棠晓月精装两房，家电家具齐全，小区环境好配套齐全。","145","12719元/㎡","2室1厅1卫","海棠晓月A区-南坪东路581号","114㎡"
"嘉湾一号 豪华装修房 业主诚心 急卖","120","13772元/㎡","3室2厅1卫","渝能嘉湾壹号-蔡家岗二手房出售-同康路18号","87㎡"
"人和华夏城 精装三房 住家装修 美丽 诚心出售 随时看房","128","10756元/㎡","3室2厅2卫","人和华夏城一...-人和二手房出售-人兴路301-303号","119㎡"
"金科花园洋房品质楼盘高端住宅小区业主急售秀湖公园商圈","132","10983元/㎡","3室2厅2卫","金科中央公园...-西江大道28号","120㎡"
"2楼2楼，伍华花园精装修4室，甩甩甩","42","2745元/㎡","3室2厅2卫","五华花园-凤城二手房出售-黄桷路19号","153㎡"
"鲁能品质小区 住家精装三房 临近体育馆 业主诚心出售","105","12867元/㎡","3室2厅1卫","鲁能南渝星城-鱼洞二手房出售-箭河路600号","81㎡"
"轻轨站旁恒大优活城 三房双卫 中间楼层 朝小区中庭 采光好","135","11637元/㎡","3室2厅2卫","恒大优活城-土主二手房出售-永青路98号","116㎡"
"60万的公寓卖45万。你还在等什么","45","11718元/㎡","2室1厅1卫","龙湖好城时光-西永二手房出售-西双大道16号","38㎡"
"宝圣湖圣湖天域精装3房 小区位置好 装修保持新 价格美丽","128","12673元/㎡","3室2厅1卫","圣湖天域-回兴二手房出售-宝桐路1号","101㎡"
"江北北滨路轻轨3号线 招商江湾城 看中庭 朝南 观江景","380","19897元/㎡","4室2厅2卫","招商江湾城-华新街二手房出售-北滨一路363号","190㎡"
"北滨路轻轨3号线 招商江湾城 精装修大三房","265","19542元/㎡","3室2厅2卫","招商江湾城-华新街二手房出售-北滨一路363号","135㎡"
"回兴轻轨站 精装一房 户型方正 家具家电齐全 近永辉超市","58","12608元/㎡","1室1厅1卫","伴山名都-回兴二手房出售-兴科大道293号","46㎡"
"北滨路轻轨3号线 御龙天峰旁招商江湾城 朝南 看中庭看江看湖","380","23045元/㎡","4室2厅2卫","招商江湾城-华新街二手房出售-北滨一路363号","164㎡"
"金龙大道 北京城建 经 典家装三室 户型方正 采光好 环境优","76","8172元/㎡","3室3厅1卫","欧陆经典住宅...-金龙大道388号","93㎡"
"重庆天地 翠湖天地 精装修两房 朝中庭 全新未住","175","20348元/㎡","2室2厅1卫","瑞安翠湖天地-化龙桥二手房出售-永嘉路45号","86㎡"
"净化总厂小区，带院馆，全新装修3室2厅2卫，电梯房，可做四室","48","3779元/㎡","3室2厅2卫","长寿石油桃花...-凤城二手房出售-桃花大道44号","127㎡"
"桃花电梯房，精装修3室2厅2卫，能按揭，甩甩甩","42","4285元/㎡","3室2厅2卫","瑞鸥金山华府-凤城二手房出售-金山街8号","98㎡"
"带书房精装修3室2厅2卫小区电梯房，业主急售","46","3709元/㎡","3室2厅2卫","云顶香榭-凤城二手房出售-黄东路3号","124㎡"
"江北嘴北滨路 一线看江大平层 可变四房 双轻轨旁 业主急售！","300","17241元/㎡","4室2厅2卫","融景城郦苑-北滨路二手房出售-北城三路65号","174㎡"
"高职城大学门口 单价8000起的小户型公寓 位置好 快","38","7755元/㎡","1室1厅1卫","西部人才产业...-一品二手房出售-尚文大道810号","49㎡"
"江北嘴绿地保税现房5.1米层高公寓，政府扶持减免.税收政策！","48","12307元/㎡","2室1厅1卫","绿地保税中心-寸滩二手房出售-金渝大道138号","39㎡"
"急售，城中城旁边顺风亭精装修2室电梯房，见钱就卖","26.5","3680元/㎡","2室2厅1卫","乐至顺风庭1...-凤城二手房出售-经开路7号","72㎡"
"。三峡广场旁 豪华精装2房 融汇温泉童话里 出入方便。","125","18382元/㎡","2室2厅1卫","融汇温泉城童...-杨公桥二手房出售-杨梨路,近天梨路","68㎡"
"业主 急售广龙明珠 电梯家装两房 家具家电齐 ***39.8","39.8","5605元/㎡","3室2厅1卫","广龙明珠-水井巷30号","71㎡"
"品质小区 罗马假日，精装1房，朝小区中庭，户型方正，随时看房","66","13200元/㎡","1室1厅1卫","金阳罗马假日-经开区二手房出售-青龙路36号","50㎡"
"江北汽博附近 双轻轨小户型 低首付低总价购2房 送阁楼 速度","45","11538元/㎡","1室1厅1卫","绿地保税中心-寸滩二手房出售-金渝大道138号","39㎡"
"2楼2楼，伍华花园精装修4室，甩甩甩","42","2745元/㎡","3室2厅2卫","五华花园-凤城二手房出售-黄桷路19号","153㎡"
"北滨路上轻轨站旁实得550平方全套房","410","13666元/㎡","5室4厅4卫","中海北滨1号-北滨路二手房出售-北滨一路528号","300㎡"
"业主急售 恒鑫一期大三房 南北通透 低于市场价20万 好看房","126","8882元/㎡","3室2厅2卫","恒鑫名城一期-二郎二手房出售-石新路218号","141㎡"
"渝北龙庭雅居精装2房拎包入住73 105万","105","14383元/㎡","2室2厅1卫","龙庭雅居-人和二手房出售-万年路255号","73㎡"
"普罗旺斯东岸 正宗的四房 送露台 小区中心 价格实惠新城地段","77.6","6466元/㎡","4室2厅2卫","泽京普罗旺斯...-龙城大道799号","120㎡"
"尚风名居家装大两房可改三房户型方正视线开阔拎包入住看双语小学","51.8","5755元/㎡","2室2厅1卫","尚风名居-法建路68号","90㎡"
"汽博复地天玺 超大清水三房 南北通透 全景高尔夫 仅此一套","280","18666元/㎡","3室2厅2卫","复地天玺-鸳鸯二手房出售-金渝大道，近金开大道","150㎡"
"财富中心  湖景3房  带家具家电  精装修 拎包入住","240","17266元/㎡","3室2厅2卫","财富中心国际...-冉家坝二手房出售-洪湖东路51号","139㎡"
"恒大二期新房 端户看别墅 中楼层视野开阔 急售全款可谈价","93","8230元/㎡","3室2厅2卫","恒大金碧天下-恒大大道1号","113㎡"
"差钱急售4室2厅2卫清水117卖65万","65","5555元/㎡","4室2厅2卫","奥体中央公园-李渡二手房出售-聚贤大道19号","117㎡"
"观音桥 伊美天街SOHO 酒店式公寓 现房精装带租约 双轻轨","117","20172元/㎡","1室1厅1卫","万汇中心-观音桥二手房出售-北城天街38号","58㎡"
"复地天玺 朝高尔夫球场 外圈位置 大四房 板式结构","233","15228元/㎡","4室2厅2卫","复地天玺-鸳鸯二手房出售-金渝大道，近金开大道","153㎡"
"次新房 近轻轨 采光户行佳 价格可以走展....","180","14715元/㎡","4室2厅2卫","万友七季城C...-学府大道二手房出售-回龙路90号","122㎡"
"CBD商圈跃层42带家电家具仅33万卖","33","7857元/㎡","3室2厅1卫","重报时代中央-李渡二手房出售-太白大道","42㎡"
"。杨公桥轻轨旁 华宇星领地 精装三房 采光好 业主急售。","161","17988元/㎡","3室1厅1卫","华宇星领地-杨公桥二手房出售-大杨公桥36号","89㎡"
"移民广场东方大厦，三室一厅一卫。适合三口之家","70","7291元/㎡","3室2厅1卫","祥瑞东方大厦-柱山二手房出售-静园路849号","96㎡"
"巴滨路，住家别墅，降价了，降价了香山美墅","399.9","15996元/㎡","5室3厅3卫","融汇半岛香山...-李家沱二手房出售-博文二路99号","250㎡"
"同元御府华庭 精装三室两厅","62","6526元/㎡","3室2厅1卫","同元御府华庭-凤城二手房出售-桃源西四路3号","95㎡"
"只需34万买淮远河旁的锦绣江南清水3房 下手快得","50.6","4600元/㎡","3室2厅2卫","铜梁锦绣江南-迎宾路288号","110㎡"
"回兴品质楼盘东衡槟城精装大两房带实验三小指标中间楼层采光好","115","12777元/㎡","2室2厅1卫","东衡槟城-两路二手房出售-翠苹路11号","90㎡"
"竹林学校对面，精装大两房，外阳台设计，朝小区中庭，业主安心卖","120","13186元/㎡","2室2厅1卫","大竹林商业中...-大竹林二手房出售-金开大道西段206号","91㎡"
"东方剑桥精装2房，重大旁 沙小旁 重百旁 大一中旁","86","11227元/㎡","2室2厅1卫","东方剑桥南区-大学城二手房出售-大学城中路17号","76㎡"
"大学城附近 缤果城正宗家装两房毛坯价急售 急售","41","6589元/㎡","2室2厅1卫","缤果城-义乌大道314号","62㎡"
"江北观音桥，半山华府，装修三居室，板式结构，龙湖物业","205","16666元/㎡","3室2厅2卫","半山华府-北滨路二手房出售-兴竹路21号","123㎡"
"华润公园便宜房子 一线江景 记住是带车位90万","80","16959元/㎡","1室1厅1卫","华润中央公园-大石坝二手房出售-红原路66号","47㎡"
"观音桥商圈中心旁 公园环抱 价格低 住家首 选 交通方便","115","9426元/㎡","3室2厅2卫","鸿恩怡园-红旗河沟二手房出售-桥鸿路,近无名小路","122㎡"
"急急急 龙溪镇转盘 总价低 楼梯2房可改3房 低楼层 手慢无","77.8","10103元/㎡","2室2厅1卫","金绸花园-龙溪二手房出售-金龙路75号","77㎡"
"渝北礼嘉华侨城江边 阚江联排别墅星光巴蜀双带3个产权车位","580","17846元/㎡","4室3厅4卫","华侨城天澜美...-礼嘉二手房出售-礼勤路","325㎡"
"河嘉村3室1厅 50万  难得的好房 户型方正 ！！","50","5882元/㎡","3室1厅1卫","河嘉村小区-朝阳二手房出售-河嘉村76号","85㎡"
"城北竹芸山水视野开阔  生活方便","75","8426元/㎡","2室1厅1卫","渝复竹芸山水-城北新区二手房出售-金华路399号","89㎡"
"渝开学校旁月升楼 正规两房 装修清爽 户型方正 采光好诚心卖","79","14107元/㎡","2室1厅1卫","月升楼-龙溪二手房出售-松石二巷16号附12号","56㎡"
"大渡口区建设村附近 云岭天城 正规两室 出行方便 交通便利","65","11206元/㎡","2室2厅1卫","云岭天城-跃进村二手房出售-钢花路27号","58㎡"
"渝北人和 金开大道上 万紫山 住家精装两房 交通便利拎包入住","86","11621元/㎡","2室2厅1卫","万紫山社区-人和二手房出售-万年路428号","74㎡"
"西站旁三轻轨精装公寓，15年租约，租金3000，亚朵酒店入驻","50","10869元/㎡","1室1厅1卫","中航九悦荟-二郎二手房出售-火炬大道5号","46㎡"
"人和两房 采光好 视野不错","56","10370元/㎡","2室2厅1卫","人和康居二期-人和二手房出售-龙寿路1018号","54㎡"
"3号线 万达商圈旁 浪高亮阁 精装1房 中间楼层 酒店式装修","38","12881元/㎡","1室1卫","亮阁-南坪二手房出售-江南大道","29㎡"
"大礼堂 学田湾菜市场边 上4楼 正规三房 户型方正 住家方便","60","7500元/㎡","3室2厅1卫","下罗家湾小区-两路口二手房出售-下罗家湾3-45号","80㎡"
"品质小区豪华装修赠送面积大","68","5483元/㎡","3室2厅2卫","蓝湖丽都-五星大道388号","124㎡"
"渝能国际门口轻轨站 精装修跃层 实得面积130平米 拎包入住","146","17176元/㎡","3室2厅2卫","渝能国际-学府大道二手房出售-学府大道51号","85㎡"
"渝能国际 精装修大三房 看南山永无遮挡 视野好","165","13095元/㎡","3室2厅2卫","渝能国际-学府大道二手房出售-学府大道51号","126㎡"
"荣昌二手房.银科大厦.出入方便.居家良品","28.8","4792元/㎡","2室2厅1卫","天正西城峰3...-西大街133号","60㎡"
"畔溪名都联排别墅精装四层带大花园","390","11620元/㎡","5室2厅2卫","畔溪名都-龙凤桥二手房出售-龙溪路,近奔月路","335㎡"
"鹅公岩大桥旁独栋江景别墅，送538平米花园，仅需750万","750","18248元/㎡","5室3厅7卫","世纪花园别墅-铜元局二手房出售-丹龙路6号","411㎡"
"大石坝东海岸 正规跃层两房 户型方正 采光好 赠送面积大","103","17758元/㎡","2室2厅1卫","东海岸-大石坝二手房出售-红石路","58㎡"
"渝中两江豪装70年大产权来福士坐拥两江交汇名流汇聚","730","35096元/㎡","3室2厅3卫","重庆来福士广...-朝天门二手房出售-陕西路9号","208㎡"
"新盘茶园新区 东站旁的别墅 读名校 带花园和地下室","185","12585元/㎡","4室2厅3卫","融创欧麓花园...-界石二手房出售-甘泉路288号","147㎡"
"茶园高端叠拼别墅环境超好  保亿湖山鹿鸣 带大花园送产权车位","180","12000元/㎡","5室2厅2卫","融创欧麓花园...-界石二手房出售-金鹿大道","150㎡"
"临轻轨，临超市，交通方便，小区配套齐全","180","12162元/㎡","3室1厅1卫","融创欧麓花园...-界石二手房出售-甘泉路288号","148㎡"
"低于市场行情价10万 业主缺钱急售","82","7454元/㎡","3室2厅2卫","恒大金碧天下-恒大大道1号","110㎡"
"观音桥步行街城市领地带指标43平米精装房75万急售","75","17857元/㎡","1室1厅1卫","城市领地-观音桥二手房出售-建新南路18号","42㎡"
"四面山精装修2房，单价3600，家电齐全，环境优美","26","3768元/㎡","2室2厅1卫","建驰云岭翠湖-西彭二手房出售-四面山东胜街","69㎡"
"东海翠庭小两房高层视线好","37.6","6836元/㎡","2室2厅1卫","东海滨江城观...-嘉陵路29号","55㎡"
"（特价房）宝龙shangzhu楼豪华装修仅售32万","32","8510元/㎡","2室2厅1卫","宝龙城市广场...-合阳大道618号","37㎡"
"城南 浩博方山镜 精装三房 采光好 业主安心卖","110","11509元/㎡","3室2厅2卫","浩博方山境-城南新区二手房出售-将军路818号","95㎡"
"渝北鸳鸯丰源丽景精装3房2卫 正对面 带指标 双轻轨","170","13600元/㎡","3室2厅2卫","丰源丽景-鸳鸯二手房出售-鸳鸯北路16号","125㎡"
"棕榈泉法式品质独栋 ，送830平米花园","2800","39270元/㎡","6室3厅6卫","棕榈泉山顶别...-双凤桥二手房出售-金开大道","713㎡"
"蔡家轻轨站的写字楼 户型好 采光好 价格美丽","52","10196元/㎡","2室2厅1卫","旭辉紫都-蔡家岗二手房出售-嘉瑞大道18号","51㎡"
"你买的不是房子是美好的生活开始。","96","9504元/㎡","3室2厅2卫","鸥鹏璧兰河1...-其他二手房出售-双星大道31号","101㎡"
"照母山世茂茂悦府内圈法式大联排双车位花园80大四房业主诚售","360","15254元/㎡","4室2厅4卫","世茂茂悦府(...-汽博中心二手房出售-湖红路365号","236㎡"
"大竹林金科天元道清水3房带外阳台 靠轻轨临商场 高品质小区","145","15425元/㎡","3室2厅1卫","金科天元道-大竹林二手房出售-斑竹路8号","94㎡"
"西城的湖精装2房，82万，拎包入住，科技学院旁","82","12812元/㎡","2室2厅1卫","西城的湖-大学城二手房出售-大学城中路21号","64㎡"
"兆甲 龙湖美岸湿地公园环抱 交通便利配套设施完善 适合居住","80.5","7187元/㎡","3室2厅2卫","龙湖美岸-将军路166号","112㎡"
"观音桥商圈 煌华晶萃城 精装单配 带华新学校指标 诚心出售","78","20286元/㎡","1室1卫","煌华晶萃城-观音桥二手房出售-三钢一路,近建新南路","38㎡"
"赠屋顶花园 九公里轻轨站青岗湾花园洋房顶跃带大露台精装四房","150","16853元/㎡","4室2厅2卫","曦圆青岗湾-李家沱二手房出售-巴南大道16号","89㎡"
"渝北悦来 首地江山赋 朝中庭 小区环境优雅 出行方便","107","14861元/㎡","3室2厅1卫","首地江山赋-悦来二手房出售-悦山路5号","72㎡"
"大竹林江与城旁精装三房双卫 住家装修 楼下就是商业街","148","12231元/㎡","3室3厅2卫","大竹林商业中...-大竹林二手房出售-金开大道西段206号","121㎡"
"北滨路招商江湾城（豪华4房）高楼层朝中庭，（价格美丽）","279","20977元/㎡","4室2厅2卫","招商江湾城-华新街二手房出售-北滨一路363号","133㎡"
"总价50左右万，拎包入住照母山地铁口精装公寓，3学府，低总价","46","17037元/㎡","1室1厅1卫","康桥融府-汽博中心二手房出售-湖霞街1号","27㎡"
"美丽泽京独特装修风格，等喜欢的你来选","58.6","8492元/㎡","3室2厅1卫","美丽泽京-金龙大道","69㎡"
"繁华地段，住家装修，保持全新，超大阳台视野开阔，急卖。","58","7435元/㎡","2室2厅1卫","水木年华朗苑-瑞安路1号","78㎡"
"你买的不是房子是美好的生活开始。","96","9504元/㎡","3室2厅2卫","鸥鹏璧兰河1...-其他二手房出售-双星大道31号","101㎡"
"照母山世茂茂悦府内圈法式大联排双车位花园80大四房业主诚售","360","15254元/㎡","4室2厅4卫","世茂茂悦府(...-汽博中心二手房出售-湖红路365号","236㎡"
"蔡家公园旁大小区环境优美2房清水","86","11131元/㎡","2室2厅1卫","正源福源-蔡家岗二手房出售-蔡扬路355号","77㎡"
"力帆爱琴海万瑞大平层 总统套房 奢华享受  视野 一线国际","298","17769元/㎡","2室2厅2卫","力帆红星国际...-汽博中心二手房出售-龙安路7号","167㎡"
"渝北消防总队旁 海州国际新小区 正规2房 户型方正采光好","125","10451元/㎡","2室1厅1卫","海洲国际公寓-人和二手房出售-云杉北路81号","119㎡"
"长运花园 精装2室 带家具电器 楼层好视野好","35","5000元/㎡","2室2厅1卫","长运花园-荔枝二手房出售-顺江大道21号","70㎡"
"北山庄园经典洋房小区环境好，户型好，","96","7384元/㎡","4室2厅2卫","北山庄园-二环北路中段369号","130㎡"
"兴龙湖高端洋房，置城物业，近高铁洋房区，业主诚心出售","88","5866元/㎡","3室2厅2卫","置铖御府二期-昌州大道东段801号","150㎡"
"茶园长生桥轻轨站旁 鲁能领秀城骏峰 精装3房 近永辉超市","125","16269元/㎡","3室2厅1卫","鲁能领秀城骏...-茶园新区二手房出售-天文大道35号","76㎡"
"交通大学家属楼三房两厅带装修环境好没有物管费二塘轻轨","70","6930元/㎡","3室2厅1卫","交通大学家属...-学府大道二手房出售-学府大道71号","101㎡"
